job_title,company,date_posted,location,remote_status,employment_type,schedule,license_requirements,salary_range,job_description,apply_link,specialties,source_site,scraped_at
Nurse Case Manager I,Elevance Health,2025-12-27,"Miami, FL",Remote,Regular | Perm Employee,Regular | Perm Employee,"In Person Meetings, Remote, Training On-Site",,"Anticipated End Date:2026-01-26Position Title:Nurse Case Manager IJob Description:Nurse Case Manager ILocation:Miami, FLThis role enables associates to work virtually full-time, with the exception of required in-person training sessions, providing maximum flexibility and autonomy. This approach promotes productivity, supports work-life integration, and ensures essential face-to-face onboarding and skill development.Please note that per our policy on hybrid/virtual work, candidates not within a reasonable commuting distance from the posting location(s) will not be considered for employment, unless an accommodation is granted as required by law.Founded in 2005,HealthSunis a local Medicare Managed Care Organization with administrative offices located in Coconut Grove, Florida. Serving more than 50,000 members, HealthSun is one of the fastest growing health plans in South Florida. As a local plan, we recognize the healthcare needs of our community and strive to provide our members with only the best service and experience possible.TheNurse Case Manager Iis responsible for performing care management within the scope of licensure for members with complex and chronic care needs by assessing, developing, implementing, coordinating, monitoring, and evaluating care plans designed to optimize member health care across the care continuum. Performs duties telephonically or on-site such as at hospitals for discharge planning.How You Will Make an Impact:Primary duties may include, but are not limited to:Ensures member access to services appropriate to their health needsConducts assessments to identify individual needs and a specific care management plan to address objectives and goals as identified during assessment.Implements care plan by facilitatingauthorizations/referralsas appropriate within benefits structure or through extra-contractual arrangements.Coordinates internal and external resources to meet identified needs.Monitors and evaluates effectiveness of the care management plan and modifies as necessary.Interfaces with Medical Directors and Physician Advisors on the development of care management treatment plans.Assists in problem solving with providers, claims or service issues.Minimum Requirements:Requires BA/BS in a health related field and minimum of 3 years of clinical experience; or any combination of education and experience, which would provide an equivalent background.Current, unrestricted RN license in applicable state(s) required. Multi-state licensure is required if this individual is providing services in multiple states.Preferred Skills, Capabilities & Experiences:Certification as a Case Manager is preferred.Bilingual English/Spanish highly preferred.MS Office Suite good working knowledge preferred.For URAC accredited areas the following applies: Requires BA/BS and 3 years of clinical care experience; or any combination of education and experience, which would provide an equivalent background. Current and active RN license required in applicable state(s). Multi-state licensure is required if this individual is providing services in multiple states. Certification as a Case Manager and a BS in a health or human services related field preferred.Job Level:Non-Management ExemptWorkshift:1st Shift (United States of America)Job Family:MED > Licensed NursePlease be advised that Elevance Health only accepts resumes for compensation from agencies that have a signed agreement with Elevance Health. Any unsolicited resumes, including those submitted to hiring managers, are deemed to be the property of Elevance Health.Who We AreElevance Health is a health company dedicated to improving lives and communities - and making healthcare simpler. We are a Fortune 25 company with a longstanding history in the healthcare industry, looking for leaders at all levels of the organization who are passionate about making an impact on our members and the communities we serve.How We WorkAt Elevance Health, we are creating a culture that is designed to advance our strategy but will also lead to personal and professional growth for our associates. Our values and behaviors are the root of our culture. They are how we achieve our strategy, power our business outcomes and drive our shared success - for our consumers, our associates, our communities and our business.We offer a range of market-competitive total rewards that include merit increases, paid holidays, Paid Time Off, and incentive bonus programs (unless covered by a collective bargaining agreement), medical, dental, vision, short and long term disability benefits, 401(k) +match, stock purchase plan, life insurance, wellness programs and financial education resources, to name a few.Elevance Health operates in a Hybrid Workforce Strategy. Unless specified as primarily virtual by the hiring manager, associates are required to work at an Elevance Health location at least once per week, and potentially several times per week. Specific requirements and expectations for time onsite...",https://elevancehealth.wd1.myworkdayjobs.com/ANT/job/FL-MIAMI-11430-NW-20TH-ST-STE-300/Nurse-Case-Manager-I_JR178030,"Case Management | Care Management, Entry Level, Registered Nurse | RN",Remote Nurse Connection,2026-01-03T09:22:01.442540
Clinical Reviewer RN (Remote in TN),Maximus,2025-12-27,,Remote,Regular | Perm Employee,Regular | Perm Employee,Remote,,"General informationDateFriday, December 26, 2025CityRemoteCountryUnited StatesWorking timeFull-timeDescription & RequirementsMaximus is seeking aClinical Reviewer (Registered Nurse)to support the Tennessee (TN) Appeals area of the contract. In this role, the RN Clinical Reviewer is responsible for reviewing clinical cases, applying nursing judgment and regulatory guidelines, and ensuring each case is accurately assessed and routed to the appropriate department or escalated as needed. This position plays a critical role in maintaining compliance, supporting timely appeal resolutions, and ensuring high-quality, clinically sound decision-making.About the Program: Tennessee Long-Term Services and Supports (TN LTSS) refers to a coordinated system of programs and services designed to assist individuals who have chronic illnesses, disabilities, or functional limitations and need ongoing support to live as independently and safely as possible. TN LTSS includes a range of home- and community-based services (HCBS) and institutional care options that help individuals with activities of daily living, medical needs, and personal care, while prioritizing care in the least restrictive setting. The program supports older adults and individuals with physical, intellectual, or developmental disabilities through person-centered planning that promotes dignity, independence, and quality of life.Why Maximus? Work/Life Balance Support - Flexibility tailored to your needs! Competitive Compensation - Bonuses based on performance included! Comprehensive Insurance Coverage - Choose from various plans, including Medical, Dental, Vision, Prescription, and partially funded HSA. Additionally, enjoy Life insurance benefits and discounts on Auto, Home, Renter's, and Pet insurance. Future Planning - Prepare for retirement with our 401K Retirement Savings plan and Company Matching.Paid Time Off Package - Enjoy PTO, Holidays, and extended sick leave, along with Short and Long Term Disability coverage. Holistic Wellness Support - Access resources for physical, emotional, and financial wellness through our Employee Assistance Program (EAP). Recognition Platform - Acknowledge and appreciate outstanding employee contributions. Tuition Reimbursement - Invest in your ongoing education and development. Employee Perks and Discounts - Additional benefits and discounts exclusively for employees. Maximus Wellness Program and Resources - Access a range of wellness programs and resources tailored to your needs. Professional Development Opportunities-Participate in training programs, workshops, and conferences.Licensures and Certifications-Maximus assumes the expenses associated with renewing licenses and certifications for its employees.Essential Duties and Responsibilities:Review requests for services including admission, discharges and continued stays for adherence to clinical criteria, state and federal policy, and related requirements.Issue approvals, denials or recommendations based on contract requirements.Identify need for additional clinical documentation or consultation.Complete documentation of activities within contract systems.Communicate with providers, individuals and their designees, or state workers as required.Performs other related duties as assigned.Minimum RequirementsCurrent Registered Nurse (RN) license valid in the state of practice is requiredHigh School Degree or equivalent requiredMinimum 2 years of clinical experience requiredMinimum of one (1) year of registered nurse experiencePreferred RequirementsKnowledge of mental health principles and practicesExperience in physical rehabilitationAttention to detailHome Office RequirementsMaximus provides company-issued computer equipment and/or cell phoneReliable high-speed internet serviceMinimum 20 Mpbs download speeds/50 Mpbs for shared internet connectivityMinimum 5 Mpbs upload speedsPrivate and secure workspace#ClinicalServicesEEO StatementMaximus is an equal opportunity employer. We evaluate qualified applicants without regard to race, color, religion, sex, age, national origin, disability, veteran status, genetic information and other legally protected characteristics.Pay TransparencyMaximus compensation is based on various factors including but not limited to job location, a candidate's education, training, experience, expected quality and quantity of work, required travel (if any), external market and internal value analysis including seniority and merit systems, as well as internal pay alignment. Annual salary is just one component of Maximus's total compensation package. Other rewards may include short- and long-term incentives as well as program-specific awards. Additionally, Maximus provides a variety of benefits to employees, including health insurance coverage, life and disability insurance, a retirement savings plan, paid holidays and paid time off. Compensation ranges may differ based on contract value but will be commensurate with job duties and relevant w...",https://www.linkedin.com/jobs/view/clinical-reviewer-rn-remote-in-tn-at-maximus-4346761062,"Entry Level, Long Term Care, Registered Nurse | RN, Utilization Management | Utilization Review",Remote Nurse Connection,2026-01-03T09:22:01.554262
Telephonic Case Manager,Crawford,2025-12-27,,Remote,Regular | Perm Employee,Regular | Perm Employee,Remote,,"Now Hiring: RN Telephonic Case Manager - RemoteWork from Home - Enjoy Flexibility & BalanceSalary: Competitive & commensurate with experienceQuarterly Bonus OpportunitiesFree CEUs for licenses & certificatesLicense & Certification ReimbursementWe're looking for an RN with a passion for case management to join our team! Must hold a multi-state Nursing License Residing in a compact state National Certification preferred (CCM, CRC, COHN, CRRC) Workers' Comp Case Management experience a plus Your Impact: You'll provide effective case management services in a costeffective manner, delivering medical case management consistent with URAC standards, CMSA Standards of Practice, and Broadspire QA Guidelines. You'll support patients/employees receiving benefits under insurance lines including Workers' Compensation, Group Health, Liability, Disability, and Care Management.This is your chance to grow your career, earn great rewards, and enjoy true work-life balance.Apply today and make an impact in the community!",https://fa-esau-saasfaprod1.fa.ocs.oraclecloud.com/hcmUI/CandidateExperience/en/sites/crawco-jobs/job/3498,"Case Management | Care Management, Entry Level, Registered Nurse | RN",Remote Nurse Connection,2026-01-03T09:22:01.660144
"Senior PM, EHR Platform",Abridge,2025-12-27,,Hybrid,Regular | Perm Employee,Regular | Perm Employee,Hybrid,,"About AbridgeAbridge was founded in 2018 with the mission of powering deeper understanding in healthcare. Our AI-powered platform was purpose-built for medical conversations, improving clinical documentation efficiencies while enabling clinicians to focus on what matters most-their patients.Our enterprise-grade technology transforms patient-clinician conversations into structured clinical notes in real-time, with deep EMR integrations. Powered by Linked Evidence and our purpose-built, auditable AI, we are the only company that maps AI-generated summaries to ground truth, helping providers quickly trust and verify the output. As pioneers in generative AI for healthcare, we are setting the industry standards for the responsible deployment of AI across health systems.We are a growing team of practicing MDs, AI scientists, PhDs, creatives, technologists, and engineers working together to empower people and make care make more sense. We have offices located in the Mission District in San Francisco, the SoHo neighborhood of New York, and East Liberty in Pittsburgh.The RoleWe're looking for a Senior Product Manager, EHR Platform to own our EHR integrations as a strategic product surface. This role is responsible for shaping how we work with EHR platforms as our customer base, product capabilities, and market presence continue to grow.You will own our integrations with Epic, Athenahealth, Cerner, MEDITECH, and others, ensuring they are reliable, compliant, and scalable, while also evolving how these partnerships operate as our ecosystem and product matures. This includes balancing strong working relationships with clear product direction and long-term platform thinking.This is a senior, high-judgment role. You'll be trusted to navigate complex partner environments, represent customer needs with confidence, and make thoughtful tradeoffs that support both near-term execution and sustained platform value. Your work will directly impact customer launches, deal velocity, and how our product integrates into clinical workflows at scale.What You'll DoEHR Platform & IntegrationsOwn the product strategy and roadmap for our EHR platform and integrations (Epic, Athenahealth, Cerner, MEDITECH, and others).Define where we partner deeply with EHRs, where we differentiate, and how we evolve as the ecosystem changes.Translate customer needs, commercial priorities, and competitive dynamics into clear product direction and execution plans.Partner closely with Engineering to deliver integrations that are dependable, scalable, and strategically aligned.Reliability, Compliance & ScalabilityEnsure integrations meet healthcare compliance and security requirements (e.g., HIPAA, SOC 2, interoperability standards such as HL7/FHIR).Establish standards for reliability, data quality, and performance across the EHR platform.Anticipate and address scale challenges as adoption, data volume, and use cases expand.EHR Partnerships ManagementManage day-to-day product relationships with EHR vendors and integration partners.Coordinate certification efforts, roadmap alignment, and platform changes with external partners.Represent product priorities clearly and professionally in vendor discussions.Commercial EnablementWork with Partnerships, Sales, Customer Success, and Implementation teams to support deals and customer launches.Clearly articulate integration capabilities, constraints, and roadmap direction to the field.Incorporate customer and market feedback into ongoing product evolution and positioning.What You'll Bring4-6+ years of product management experience, including ownership of platform or integration-focused products.Direct experience working with EHR systems or building EHR integrations (required).Experience managing external partners in complex, multi-stakeholder environmentsExperience partnering with engineering teams on API-driven, data-intensive, or infrastructure-heavy products.Deep understanding of healthcare workflows, interoperability standards (HL7, FHIR), and regulated systems.Proven ability to balance execution rigor with longer-term platform and ecosystem thinking.Clear, confident communicator who can represent product strategy internally and externally.A pragmatic, decisive approach to tradeoffs across speed, quality, and strategic leverage.Why Work at Abridge?At Abridge, we're transforming healthcare delivery experiences with generative AI, enabling clinicians and patients to connect in deeper, more meaningful ways. Our mission is clear: to power deeper understanding in healthcare. We're driving real, lasting change, with millions of medical conversations processed each month.Joining Abridge means stepping into a fast-paced, high-growth startup where your contributions truly make a difference. Our culture requires extreme ownership-every employee has the ability to (and is expected to) make an impact on our customers and our business.Beyond individual impact, you will have the opportunity to work alongside a team of curious, hi...",https://jobs.ashbyhq.com/Abridge/0748323e-1f9f-4f19-b742-d1a88ef0b484/application,"Informatics, Management | Leadership",Remote Nurse Connection,2026-01-03T09:22:01.772411
LPN/LVN- Compact License (RPM experience a plus),RPM Healthcare,2025-12-27,,Remote,Regular | Perm Employee,Regular | Perm Employee,Remote,"$45,000-$49,000","About UsRPM Healthcare is a fast-growing company with nearly 40 years of patient education experience. Our proprietary software tracks patients' physiological data (Blood Pressure, Weight, Blood Glucose, Lung Capacity, Oxygenation), identifying dangerous out-of-range values and trends that impact health.As anRPM 365 Care Coach, you'll engage patients, track and analyze their data, provide education, and encourage adherence to their care plans.About YouYou're a licensed LPN/LVN passionate about healthcare innovation and patient outcomes. Your tech-savvy, comfortable with high-volume phone outreach (125+ conversations a week), and thrive in a fast-changing environment. You're patient, empathetic, detail-oriented, and a self-starter.ResponsibilitiesServe as the primary contact for patients on the RPM365 platform.Assist with device setup and app connectivity.Engage with patients to ensure adherence to care plans.Schedule monthly check-ins and monitor patient data.Educate patients through shared resources.Notify healthcare providers of critical alerts.Attend virtual team meetings for updates.QualificationsMinimum:Active COMPACT nursing license.Knowledge of chronic conditions and related monitoring devices.Knowledge of remote patient monitoring CPT code qualifications.Proficiency with technology, computer platforms, and smartphones.Strong verbal/written communication skills.Comfortable with patient outreach and engagement.Highly organized, detail-oriented, and team-focused.Independently motivatedComfortable spending the majority of your workday engaging with patients over the phone providing support, education and guidance.Preferred:Experience in telehealth, remote patient monitoring, education, and/or customer service.Experience in weight management coachingAdditional language skills are a plus.Compensation & BenefitsSalary:$45,000-$49,000 (DOE) + performance bonuses.Schedule:Mon-Fri, 9:00 AM - 5:00 PM, EST (Remote).Benefits:PTO, sick leave, holidays, health insurance, 401(k).Training:Paid remote training provided.Growth:Opportunities for advancement within the company.Join us in improving patient outcomes through innovative remote careRPM Healthcare is an equal opportunity employer. We celebrate diversity and are committed to creating an inclusive environment for all employees. All qualified applicants will receive consideration for employment without regard to race, color, religion, gender, gender identity or expression, sexual orientation, national origin, genetics, disability, age, or veteran status.",https://rpmhealthcare.applytojob.com/apply/Dh8Om0Ibme/LPNLVN-Compact-License-RPM-Experience-A-Plus,"Entry Level, Licensed Practical Nurse | LPN | LVN, RPM | Remote Patient Monitoring, Triage | Telehealth",Remote Nurse Connection,2026-01-03T09:22:01.892702
"Associate Professor/Professor (Tenure), Nursing - Baylor University",Keypath Education,2025-12-27,,Remote,Regular | Perm Employee,Regular | Perm Employee,Remote,,"Company DescriptionKeypath Education is supporting Baylor University's search for an Associate Professor/Professor, Tenure, Nursing (Academic Year Contract) in the Louise Herrington School of Nursing (LHSON).The Louise Herrington School of Nursing (LHSON) is seeking applications for a nurse researcher, at theAssociate Professorrank, to contribute to our expanding research portfolio with an established research program, a strong external funding record, and a sustained record of publications in peer-reviewed journals. Candidates should also demonstrate and be devoted to excellence in teaching, mentoring students and junior faculty, and service.A PhD in Nursing or a related field is required.Job DescriptionMaintain an active research program, engage in multidisciplinary research, maintain a research portfolio supported by extramural funding, and maintain a strong publication record, including presentations at high-quality venues. The candidate is expected to teach, engage in mentoring students and/or junior faculty, participate in the development and delivery of curricula related to scholarly interest, demonstrate respect and professionalism at all times, actively engage in faith-based activities, and provide service to the School, University, professional field, and community.The successful candidate will be officing in the Academic Building of the Louise Herrington School of Nursing at 333 N. Washington Ave., Dallas, Texas, or may work remotely.QualificationsPh.D. in Nursing or closely related field is requiredActive program of research with a strong record of external research funding is requiredSustained record of publications in peer-reviewed journals is requiredNational certification is required. All candidates must be eligible for unrestricted licensure as a Registered Nurse in the state of TexasFaculty rank and tenure appointment will be dependent upon credentials, experience, program of research, sustained record of publications, and record of significant research funding. The successful candidate is expected to maintain an active, multidisciplinary funded research program, engage in teaching and mentoring, collaborate effectively with other faculty and staff, and establish strong ties with the Baylor community.Applications must include:Cover letter/letter of applicationStatement of FaithThree letters of recommendationCurrent curriculum vitaeOfficial transcripts of the highest degree earnedAll applicants must complete the self-disclosed Religious Affiliation Form (RAF).For priority consideration, please submit a completed application by July 28, 2025.Completed applications will be reviewed immediately and will be accepted until the position is filled.Salary is commensurate with experience and qualifications. The budgeted salary range that the University reasonably expects to pay for this position is $120,000 - $ 145,000. This range takes into account the wide range of factors that are considered in making compensation decisions including but not limited to experience, skills, knowledge, abilities, education, licensure and certification, analysis of internal equity, and other business and organizational needs.Additional InformationAbout Baylor University in Dallas:As the oldest college in Texas, Baylor University has a population of 21,000 diverse students. While the main campus is in"">downtown Dallasby the Baylor University Medical Center. Baylor is one of the top universities in the nation, having been named an R1 institution by the Carnegie Classification in January 2022. Baylor is also on the honor roll of the ""Great Colleges to Work For"" fromThe Chronicle of Higher Education;Baylor offers competitive salaries and"">Baylor in Deeds, guides the University as we continue to live up to Baylor's"">Baylor Benefits & Advantages.Equal Employment Opportunity StatementBaylor University, a private not-for-profit university affiliated with the Baptist General Convention of Texas, is committed to compliance with all applicable anti-discrimination laws, including those regarding age, race, color, sex, national origin, military service, genetic information, and disability. Baylor complies with statutory Affirmative Action/Equal Opportunity requirements. Baylor's full officialCompensation: USD120000- USD145000- yearlyCompany Job Link:https://jobs.smartrecruiters.com/KeypathEducation/744000100673804-associate-professor-professor-tenure-nursing-baylor-universityAPPLY HERE",https://jobs.smartrecruiters.com/KeypathEducation/744000100673804-associate-professor-professor-tenure-nursing-baylor-university,"Advanced Practice Nurse, Education | Academic",Remote Nurse Connection,2026-01-03T09:22:02.006185
