job_title,company,date_posted,location,remote_status,employment_type,schedule,license_requirements,salary_range,job_description,apply_link,specialties,source_site,scraped_at
"Associate Manager, Clinical Health Services",CVS Health,2025-12-27,,Remote,Regular | Perm Employee,Regular | Perm Employee,Remote,"$80,340.00 - $173,040","At CVS Health, we're building a world of health around every consumer and surrounding ourselves with dedicated colleagues who are passionate about transforming health care.As the nation's leading health solutions company, we reach millions of Americans through our local presence, digital channels and more than 300,000 purpose-driven colleagues - caring for people where, when and how they choose in a way that is uniquely more connected, more convenient and more compassionate. And we do it all with heart, each and every day.Program OverviewHelp us elevate our patient care to a whole new level! Join our Aetna team as an industry leader in serving dual eligible populations by utilizing best-in-class operating and clinical models. You can have life-changing impact on our Dual Eligible Special Needs Plan (DSNP) members, who are enrolled in Medicare and Medicaid and present with a wide range of complex health and social challenges. With compassionate attention and excellent communication, we collaborate with members, providers, and community organizations to address the full continuum of our members' health care and social determinant needs. Join us in this exciting opportunity as we grow and expand DSNP to change lives in new markets across the country.Position SummaryThe Associate Manager, Clinical Health Service will oversee the implementation of healthcare management services for assigned functional area.Fundamental ComponentsImplements clinical policies & procedures in accordance with applicable regulatory and accreditation standards (e.g., NCQA, URAC, state and federal standards and mandates as applicable)Serve as a content model expert and mentor to the team regarding practice standards, quality of interventions, problem resolution and critical thinkingEnsure implementation and monitoring of best practice approaches and innovations to better address the member's needs across the continuum of careMay act as a liaison with other key business areas.May develop/assist in development and/review new training contentMay collaborate/deliver inter and intra-departmental training sessionsProtects the confidentiality of member information and adheres to company policies regardingconfidentialityManages resources responsible for identification of members, development and implementation of care plans, enhancement of medical appropriateness and quality of care and monitoring, evaluating, and documenting of careEvaluate and interpret data, identify areas of improvement, and focus on interventions to improve outcomesDevelop, initiate, evaluate, monitor, and communicate performanceexpectationsEnsures the team's understanding and use of information system capability andfunctionalityParticipate in the recruitment and hiring process for staff using clearly defined requirements in terms of education, experience, technical and performance skillsAssesses developmental needs and collaborates with others to identify and implement action plans that support the development of highperforming teamsEstablish an environment and work style that promotes the concept of teamwork, cross product integration, and continuum of care thinking that results in strong performanceConsistently demonstrates the ability to serve as a model change agent and lead change effortsCreate a positive work environment by acknowledging team contributions, soliciting input, and offering personal assistance, when needed Accountable for maintaining compliance with policies and procedures and implements them at the employee levelCommunicate effectively with Providers, Members, Staff and other Leaders (e.g., may provide support to the sales staff & network staff via onsite customer visits and/or presentations)RequiredQualificationsCandidate must have an active and unrestricted Registered Nurse (RN) License in the state of residence OR an active and unrestricted Licensed Clinical Social Worker (LCSW) in the state of residence3 - 5 years in clinical area of expertiseConfidence working at home/independent thinker, using tools to collaborate and connect with teams virtuallyCandidate must work MST or PST Business Hours: This position oversees Markets in NV and UTPreferredQualificationsManaged Medicare experiencePrevious management experienceEducationAssociate's Degree in Nursing (REQUIRED)Bachelor's Degree in Nursing OR Master's Degree in Behavioral Health Field (PREFERRED)LicenseActive and unrestricted Registered Nurse (RN) License in the state of residence OR an active and unrestricted Licensed Clinical Social Worker (LCSW) in the state of residenceAnticipated Weekly Hours40Time TypeFull timePay RangeThe typical pay range for this role is:$80,340.00 - $173,040.00This pay range represents the base hourly rate or base annual full-time salary for all positions in the job grade within which this position falls. The actual base salary offer will depend on a variety of factors including experience, education, geography and other relevant factors. This position is eligible for a...",https://cvshealth.wd1.myworkdayjobs.com/CVS_Health_Careers/job/NV---Work-from-home/Associate-Manager--Clinical-Health-Services_R0797321,"Case Management | Care Management, Management | Leadership, Registered Nurse | RN",Remote Nurse Connection,2026-01-03T09:22:02.118648
Principal Clinical Data Systems Specialist (Remote),Stryker,2025-12-27,,Remote,Regular | Perm Employee,Regular | Perm Employee,"In Person Meetings, Remote","$115,600.00 - $245,800","Work Flexibility: RemoteStryker is seeking aPrincipal Clinical Data Systems Specialistto join ourNeurovascular division. This is a remote role based anywhere within the United States.As thePrincipal Clinical Data Systems Specialistyou will provide data management expertise and support to Core teams. The successful candidate will have good knowledge of clinical data management systems, as well as global regulatory and industry rules and guidance (i.e., ICH, GCP). This role is responsible for supporting the Stryker Neurovascular Medidata Rave URL and database build activities. This position may train Clinical Data Management team members and may support activities of Clinical Data Management staff, CRO and Database Vendors.What will you doManage administration of the Rave URL activities: Report Administration, eLearning, User Roles and Core Configuration.Provide technical support for Rave study development, Rave URL modules, and site management/user access within Medidata Client Division.Lead development of study database development, including but not limited to, programming of clinical database according to CRF Specifications and programming of edit checks (edit checks, derivations, and custom functions) according to Edit Check Specifications.Support Stryker Neurovascular Global Library by programming forms, edit checks (edit checks, derivations, and custom functions) according to Stryker NV data collection standards.Lead Clinical Data and SAS Programming activities.Create and maintain Clean Patient Trackers, dashboards and operational reports.May serve as system administrator to grant user and site access using Medidata Cloud Administration for Rave (EDC and Modules), Coder, RTSM and MMI (Imaging).Follow Stryker standard processes and maintain proper documentation in performance of Medidata product administration and development activities within the Medidata Client Division and Rave URL.What you needRequiredBachelor's degree8+ years of clinical data management experience in medical device or pharmaProven expertise as a Medidata Rave super user, including URL management, database build, configuration, testing, and validation for global clinical trialsHands-on experience with PMV clinical studies, including EDC design, CRF development, edit checks, and UATStrong knowledge of data collection, reconciliation, processing, coding, reporting, and validation across clinical trial data workflowsDeep understanding of clinical data management systems and regulatory standards (ICH GCP, ISO14155, Good Data Management Practices, IDE, HIPAA, GDPR, 21 CFR Part 11)PreferredMaster's Degree in a technical or scientific disciplineMedidata Rave 5.6.4 Certified Study Administrator, Medidata Rave 5.6.4 Certified Study BuilderWorking knowledge of SAS programming, electronic data capture, and XMLC# programmingMedidata Imaging PlatformPrevious experience with complex, global trials$115,600.00 - $245,800.00 salary plus bonus eligible + benefits. Individual pay is based on skills, experience, and other relevant factors.Posted Date: 12/26/2025Travel Percentage: 10%Stryker Corporation is an equal opportunity employer. Qualified applicants will receive consideration for employment without regard to race, ethnicity, color, religion, sex, gender identity, sexual orientation, national origin, disability, or protected veteran status. Stryker is an EO employer -M/F/Veteran/Disability.Stryker Corporation will not discharge or in any other manner discriminate against employees or applicants because they have inquired about, discussed, or disclosed their own pay or the pay of another employee or applicant. However, employees who have access to the compensation information of other employees or applicants as a part of their essential job functions cannot disclose the pay of other employees or applicants to individuals who do not otherwise have access to compensation information, unless the disclosure is (a) in response to a formal complaint or charge, (b) in furtherance of an investigation, proceeding, hearing, or action, including an investigation conducted by the employer, or (c) consistent with the contractor's legal duty to furnish information.",https://stryker.wd1.myworkdayjobs.com/StrykerCareers/job/Trenton-New-Jersey/Principal-Clinical-Data-Systems-Specialist--Remote-_R553067,"Biotech | Health Tech | Medical Device, Data Analytics, Informatics, PeriOp | Operating Room | Surgical",Remote Nurse Connection,2026-01-03T09:22:02.365518
Care Manager - Registered Nurse,CVS Health,2025-12-27,,Remote,Regular | Perm Employee,Regular | Perm Employee,Remote,"$54,095.00 - $116,760","At CVS Health, we're building a world of health around every consumer and surrounding ourselves with dedicated colleagues who are passionate about transforming health care.As the nation's leading health solutions company, we reach millions of Americans through our local presence, digital channels and more than 300,000 purpose-driven colleagues - caring for people where, when and how they choose in a way that is uniquely more connected, more convenient and more compassionate. And we do it all with heart, each and every day.Job SummaryThe Care Manager-Registered Nurse is a key member of our Special Needs Plan (SNP) care team, responsible for coordinating care for members who often face multiple chronic medical and behavioral health conditions, as well as various social determinants of health (SDoH) needs. This role involves conducting comprehensive assessments to evaluate members' needs and addressing SDoH challenges by connecting them with appropriate resources and support services. The Social Worker provides education and guidance to members and their families on managing chronic conditions and navigating the healthcare system. Additionally, the Care Manager develops and implements individualized care plans, monitors member progress, advocates for necessary services, and collaborates with the interdisciplinary care team to ensure optimal health outcomes. Accurate and timely documentation of assessments and interventions is essential, as is participation in team meetings to discuss member status and care strategies.Key Responsibilities:50-75% of the day is dedicated to telephonic engagement with members and the coordination of their care.Compiles all available clinical information and partners with the member to develop an individualized care plan that encompasses goals and interventions to meet the member's identified needs.Provides evidence-based disease management education and support to help the member achieve health goals.Ensure the appropriate members of the interdisciplinary care team are involved in the member's care.Provides care coordination to support a seamless health care experience for the member.Meticulous documentation of care management activity in the member's electronic health record.Collaborate with other participants of the Interdisciplinary Care Team to address barriers to care and develop strategies for maintaining the member's stable health condition.Identifies and connects members with health plan benefits and community resources.Meets regulatory requirements within specified timelines.The Care Manager RN supports other members of the Care Team through clinical decision making and guidance as needed.Additional responsibilities as assigned by leadership to support team objectives, enhance operational efficiency, and ensure the delivery of high-quality care to members. This may include participating in special projects, contributing to process improvement initiatives, or assisting with mentoring new team members.Essential Competencies and Functions:Ability to meet performance and productivity metrics, including call volume, successful member engagement, and state/federal regulatory requirements of this role.Conduct oneself with integrity, professionalism, and self-direction.Experience or a willingness to thoroughly learn the role of care management within Medicare and Medicaid managed care.Familiarity with community resources and services.Ability to navigate and utilize various healthcare technology tools to enhance member care, streamline workflows, and maintain accurate records.Maintain strong collaborative and professional relationships with members and colleagues.Communicate effectively, both verbally and in writing.Excellent customer service and engagement skills.Required QualificationsCandidate must have active and unrestricted Compact Registered Nurse (RN) licensure in the state of residenceProficient in Microsoft Office Suite, including Word, Excel, Outlook, OneNote, and Teams, with the ability to effectively utilize these tools within the context of the CM Registered Nurse roleAccess to a private, dedicated space to conduct work effectively to meet the requirements of the positionConfidence working at home/independent thinker, using tools to collaborate and connect with teams virtually3+ years of nursing experience2+ years of case management, discharge planning and/or home healthcare coordination experiencePreferred QualificationsExperience providing care management for Medicare and/or Medicaid members.Experience working with individuals with SDoH needs, chronic medical conditions, and/or behavioral health.Experience conducting health-related assessments and facilitating the care planning process.Bilingual skills, especially English-SpanishEducationAssociate's of Science in Nursing (ASN) degree AND relevant experience in a health care-related field (REQUIRED)Bachelor's of Science in Nursing (BSN) (PREFERRED)LicenseActive and unrestricted Compact Registered Nurse (RN) licensur...",https://cvshealth.wd1.myworkdayjobs.com/CVS_Health_Careers/job/GA---Work-from-home/Care-Manager---Registered-Nurse_R0794526,"Case Management | Care Management, Entry Level, Home Health, Registered Nurse | RN",Remote Nurse Connection,2026-01-03T09:22:02.474928
Advanced Practice Nurse - Psychiatry,AtlantiCare,2025-12-27,,Remote,Regular | Perm Employee,Regular | Perm Employee,Remote,,"About Us:AtlantiCare is the area's leading health system offering integrated, patient-centered care across multiple specialties. Our comprehensive behavioral health services provide high-quality mental health and substance use care to diverse populations across southern New Jersey.We are currently seeking a dedicated and compassionatePsychiatric Nurse Practitioner (PMHNP)to join our outpatient services team.Position Summary:ThePsychiatric Nurse Practitionerwill provide direct patient care to adult individuals in an outpatient setting. You will collaborate with a multidisciplinary team-including psychiatrists, psychologists, therapists, and primary care providers-to ensure comprehensive, coordinated treatment plans for patients.Key Responsibilities:Conduct psychiatric evaluations, medication management, and follow-up appointments for outpatient clientsProvide telepsychiatry services using secure, HIPAA-compliant platformsDevelop and implement individualized treatment plansCollaborate with behavioral health team members and refer patients to appropriate internal or external resources as neededMaintain accurate and timely documentation in the electronic health record (EHR)Participate in case conferences, supervision, and quality improvement initiativesEducate patients and families on mental health conditions, treatment options, and medication adherenceQualifications:Licensed (or eligible for licensure) as an Advanced Practice Registered Nurse in NJCertified in specialtyDEA license with the ability to prescribe psychiatric medicationsExperience in outpatient psychiatry preferred (new grads with strong training and interest in outpatient care may be considered)Comfortable with telehealth platforms and remote patient careStrong communication, collaboration, and organizational skillsPassion for providing equitable, culturally competent mental health careWhat We Offer:Competitive compensation and benefits packageUp to 264 hours of PTO annuallyGenerous CME allowance, plus paid CME timeSupportive, multidisciplinary behavioral health teamContinuing education opportunities and professional development supportAccess to robust EHR and telehealth toolsRelocation assistance (if applicable)Total Rewards at AtlantiCareAt AtlantiCare, we believe in supporting the whole person. Our market-competitive Total Rewards package is designed to promote the physical, emotional, social, and financial well-being of our team members. We offer a comprehensive suite of benefits and resources, including:Generous Paid Time Off (PTO)Medical, Prescription Drug, Dental & Vision InsuranceRetirement Planswith employer contributionsShort-Term & Long-Term Disability CoverageLife & Accidental Death & Dismemberment InsuranceTuition Reimbursementto support your educational goalsFlexible Spending Accounts (FSAs)for healthcare and dependent careWellness Programsto help you thriveVoluntary Benefits, including Pet Insurance and moreBenefits offerings may vary based on position and are subject to eligibility requirements.",https://myjobs.adp.com/atlanticarecareers/cx/job-details?reqId=5001131244700,"Advanced Practice Nurse, Psych | Behavioral Health | Mental Health, Triage | Telehealth",Remote Nurse Connection,2026-01-03T09:22:02.601868
Quality Assurance Specialist,MDpanel,2025-12-27,,Remote,Regular | Perm Employee,Regular | Perm Employee,Remote,,"Our Mission:MDpanel is one of the largest providers of expert medical opinions in the United States. We are committed to being the most coveted partner for physicians, carriers, attorneys, and patients by connecting those in need of medical opinions with the most qualified and highly regarded medical professionals in the U.S. MDpanel allows our member healthcare professional partners to maximize their time and produce unparalleled revenue opportunities. In return, our carrier and attorney clients receive timely, complete, thorough, and easy-to-understand opinions to support the medical legal inquiry. MDpanel is revolutionizing the medical opinion space by creating the first true marketplace to connect those in need of medical opinions to those capable of providing them. Unlike traditional, services-based models, we are devoted to our healthcare professionals and are relentless about removing the burden of administration, securing exam volume, preparing for and supporting physical examinations, backend processing, report submissions, and billing. And, at the heart of MDpanel, is our team committed to delivering an unparalleled experience for all stakeholders. We think big, start small, and move fast. Our culture is built on supporting each other with accountability, transparency, and passion for our mission.Position Summary:We are seeking a dedicated Quality Analyst professional to join our team. The ideal candidate will be responsible for reviewing provider reports for Independent Medical Evaluations (IMEs) and other associated evaluations, ensuring the highest quality and accuracy. This role serves as the final checkpoint between the physician and the customer, guaranteeing that all concerns and questions have been addressed comprehensively.Essential Roles and Responsibilities:Accurately review dictated and transcribed IME reports, correcting grammatical, spelling, or factual errors and ensuring consistency of opinions and completeness of materials reviewed.Review and verify the accuracy of reports, ensuring all physicians' recommendations are clearly articulated and all relevant questions are addressedWork closely with physicians and internal stakeholders to ensure report quality and completeness.Maintain strong communication with doctors and team members to facilitate accurate and timely report finalization.Utilized advanced technology tools to aid in the quality assurance process.Collaborate with various teams to ensure seamless operations and high-quality deliverables to our customers.Ensure reports comply with referral IME services standards and verify AMA impairment ratings (6th edition).Qualifications and Preferred Skills:Minimum of5 Years of experience in IME QA or related fields.Experience working closely with physicians, adjusters and/or attorney groups.Bachelor's degreein nursing, or similar health related fields, preferred.In-depth understanding and experience verifying 6th edition AMA impairment ratings.Knowledge of federal IME services, including Department of Labor/Longshore business.Exceptionalprofessional judgment and communication skills, both written and verbal.Additional Information:The salary range for this position is provided as an estimate based on current market conditions and company benchmarks. Actual compensation may vary depending on factors such as experience, qualifications, skills, location, and internal equity.Please note that we are unable to provide sponsorship assistance currently. All applicants must have a valid work authorization for the country in which they are applying.Please note that this compensation range is subject to change at any time and may not be applicable to all candidates. We are committed to ensuring fair and equitable pay practices and encourage applicants to discuss any questions or concerns regarding compensation during the interview process.MDpanel is an Equal Opportunity Employer. We are committed to creating a diverse and inclusive workplace where all associates feelvalued,respected, and supported. We do not discriminate based on race, color, religion, sex (including pregnancy, gender identity, and sexual orientation), national origin, age, disability, genetic information, veteran status, or any other legally protected characteristic.We are dedicated to fostering a culture of inclusion and belonging and encourage applicants of all backgrounds to apply. If you require accommodations during the application or interview process, please contact[email protected]",https://calmedeval.bamboohr.com/careers/428,"Auditing, Legal Nurse, Quality, Registered Nurse | RN",Remote Nurse Connection,2026-01-03T09:22:02.714197
