job_title,company,date_posted,location,remote_status,employment_type,schedule,license_requirements,salary_range,job_description,apply_link,specialties,source_site,scraped_at
RN Quality Improvement Coordinator - Quality Management (Hybrid),CEDARS-SINAI,2025-12-20,,Hybrid,Regular | Perm Employee,Regular | Perm Employee,"Hybrid, Remote",$45.05 - $72,"Job DescriptionAre you ready to bring your clinical competencies to a world-class Medical Group known for the very highest clinical standards? Do you have a passion for the highest quality and patient satisfaction? Then please respond to this dynamic opportunity available with one of the best places to work in Southern California! We would be happy to hear from you.The Cedars-Sinai Medical Network is committed to helping primary care and specialist physicians provide excellent care to all their patients, who benefit from convenient access to primary and specialty care physicians and seamless coordination of care between them. As a part of Cedars-Sinai, our physicians and staff are partners in quality health care from a medical center that is consistently recognized as one of the finest hospitals in the country. For the 8th consecutive year, we have been named one of the top 20 Physician Groups in Southern California by Integrated Healthcare Associates (IHA).Why work here?Beyond outstanding benefits, competitive salaries and health and dental insurance we take pride in hiring the best, most passionate employees. Our talented staff reflects the culturally and ethnically diverse community we serve. They are proof of our dedication to creating a dynamic, inclusive environment that fuels innovation and the gold standard of patient care we strive for.What will you be doing in this role?The Quality Improvement Coordinator will assess, analyze, and recommend quality and clinical performance improvement processes to assure that the highest standards of quality care can be achieved. This position will provide clinical expertise to assist with case-finding, identification of opportunities, and performance improvement activities. This position will also measure performance and identify opportunities to improve performance in value-based systems of care. As healthcare evolves with new models of service delivery, quality improvement activities will strive to ensure that care is both patient-centered and passionate about maintaining the health of our entire patient population in an efficient and effective way. This position serves as a key participant in the successful management of value-based contracts, focusing on both individual patients and population trends.Primary Duties & ResponsibilitiesIdentify and prioritize clinical cases in terms of follow up/escalation of services and/or carePerform daily chart abstraction and present patient cases to a multi-disciplinary team with possible care suggestions if applicable and follow through with implementationEngage with care managers, social workers, physicians, external vendors and other collaborators to ensure continuity of care and follow-through on plan of careDraft correspondence to patients or external vendors on behalf of the care management team or individual physiciansAggregate and clinically analyze quality and value metric data in support of Medical Directors/Chairs of the specific departments as requestedPerform in-depth analysis of individual cases as well as trend analysis across the entire population of patients as requestedCreate clinical quality and value dashboards and action reports in support of performance improvement activitiesDevelop slide decks and other communication tools and make periodic presentations to share trend information with key collaborators as requestedLead and facilitate daily and weekly meetings discussing patient care as well as other meetings ad hocParticipate in Performance Improvement activities to improve care delivery, clinical outcomes, and clinical efficiencySupport HEDIS, pay-for-performance, ACO and other clinical pay-for-performance and pay-for-value program as requestedQualificationsEducationAssociate's Degree in Nursing requiredBachelor's Degree in Nursing preferredLicenses and CertificationsValid CA RN License requiredWork ExperienceTwo (2) years of prior clinical experience in an acute or ambulatory health care setting requiredTwo (2) years of experience in support of quality improvement, process improvement or total quality measurement requiredAbout UsCedars-Sinai is a leader in providing high-quality healthcare encompassing primary care, specialized medicine and research. Since 1902, Cedars-Sinai has evolved to meet the needs of one of the most diverse regions in the nation, setting standards in quality and innovative patient care, research, teaching and community service. Today, Cedars- Sinai is known for its national leadership in transforming healthcare for the benefit of patients. Cedars-Sinai impacts the future of healthcare by developing new approaches to treatment and educating tomorrow's health professionals. Additionally, Cedars-Sinai demonstrates a commitment to the community through programs that improve the health of its most vulnerable residents.About the TeamWith a growing number of primary urgent and specialty care locations across Southern California, Cedars-Sinai's medical network serves people near wh...",https://careers.cshs.org/job/-/-/252/89679149664,"HEDIS, Quality, Registered Nurse | RN",Remote Nurse Connection,2025-12-26T09:24:58.105022
Behavioral Health Senior Care Advocate,UnitedHealth Group,2025-12-20,,Remote,Regular | Perm Employee,Regular | Perm Employee,Remote,,"At UnitedHealthcare, we're simplifying the health care experience, creating healthier communities and removing barriers to quality care. The work you do here impacts the lives of millions of people for the better. Come build the health care system of tomorrow, making it more responsive, affordable and optimized. Ready to make a difference? Join us to startCaring. Connecting. Growing together.The Senior Care Advocate (SCA) plays a key role in supporting the behavioral health needs of our members across multiple lines of business, including Commercial and Medicaid. The SCA is responsible for conducting initial, concurrent reviews, and utilization management for a variety of levels of care, including inpatient, residential, intensive outpatient, and partial hospitalization programs.This position requires solid clinical judgment, organizational skills, and the ability to effectively manage multiple priorities in a fast-paced environment. In addition to clinical work, the SCA will perform critical administrative functions, including reviewing and processing denials, documenting medical necessity, and completing the appeals process in compliance with state, federal, and plan-specific guidelines.**_ Candidates must be available to work 8:00 am - 5:00 pm PST work hours _**If you are located in the Las Vegas, NV area, you will have the flexibility to work remotely_ as you take on some tough challenges.Primary Responsibilities:Conduct utilization reviews for behavioral health services across multiple levels of care using established medical necessity criteria (InterQual, MCG, ASAM, etc.)Evaluate clinical information and determine medical necessity and level of care using established guidelines and criteriaProficiently manage cases across various lines of business including Medicaid, HPN, and CommercialParticipate in live rounds with internal teams and/or medical directors to present cases and collaborate on care determinationsReview and process medical necessity and administrative denials and associated documentation with accuracy and timelinessComplete and manage appeals cases according to required timelines and regulatory standardsCollaborate with other departments to resolve complex member needs and support care transitionsMonitor workload, prioritize tasks effectively, and demonstrate solid time management and multitasking abilitiesAdhere to all organizational policies, regulatory requirements, and confidentiality standardsYou'll be rewarded and recognized for your performance in an environment that will challenge you and give you clear direction on what it takes to succeed in your role as well as provide development for other roles you may be interested in.Required Qualifications:RN or Master's degree in social work, or related behavioral health field (LCSW, LPC, MFT etc.)Active, unrestricted behavioral health license in the state of residenceWilling and able to obtain a Nevada state license upon hire3+ years of behavioral health clinical experience in an inpatient/acute or outpatient settingFamiliarity with Medicaid, and Commercial benefit structures and utilization management protocolsAbility to work independently and within a team in a remote or office-based environmentProficient in using clinical systems, Microsoft Office applications, and electronic documentation platformsProven ability to multi-task in a high-volume, deadline-driven settingPreferred Qualifications:Current, unrestricted Nevada state licenseExperience in managed care or health plan settingsExperience with denials and appeals processingSolid knowledge of InterQual, MCG, and ASAM criteriaSoft Skills:Solid verbal and written communication skillsExcellent interpersonal, organizational, and critical thinking skillsDetail-oriented with solid critical thinking and decision-making skill_All employees working remotely will be required to adhere to UnitedHealth Group's Telecommuter PolicyPay is based on several factors including but not limited to local labor markets, education, work experience, certifications, etc. In addition to your salary, we offer benefits such as, a comprehensive benefits package, incentive and recognition programs, equity stock purchase and 401k contribution (all benefits are subject to eligibility requirements). No matter where or when you begin a career with us, you'll find a far-reaching choice of benefits and incentives. The salary for this role will range from $58,800 to $105,000 annually based on full-time employment. We comply with all minimum wage laws as applicable.At UnitedHealth Group, our mission is to help people live healthier lives and make the health system work better for everyone. We believe everyone-of every race, gender, sexuality, age, location and income-deserves the opportunity to live their healthiest life. Today, however, there are still far too many barriers to good health which are disproportionately experienced by people of color, historically marginalized groups and those with lower incomes. We are ...",https://careers.unitedhealthgroup.com/job/22776222/behavioral-health-senior-care-advocate-las-vegas-nv/,"Appeals | Denials, Case Management | Care Management, Psych | Behavioral Health | Mental Health, Registered Nurse | RN",Remote Nurse Connection,2025-12-26T09:25:00.045089
"Registered Nurse - Patient Educator (PRN) Immediate Openings - Henderson, NV",Abbott,2025-12-20,,Remote,Regular | Perm Employee,Regular | Perm Employee,Remote with Travel,$22.15 - $44,"Abbott is a global healthcare leader that helps people live more fully at all stages of life. Our portfolio of life-changing technologies spans the spectrum of healthcare, with leading businesses and products in diagnostics, medical devices, nutritionals and branded generic medicines. Our 114,000 colleagues serve people in more than 160 countries.JOB DESCRIPTION:About AbbottAbbott's Diagnostics family of businesses, bringing together exceptional teams of experts and industry leading technologies. In this role, you willprovidepersonalized Face-2-Facetraining to Acelis Connected Health's home testing customers on obtaining a finger stick blood sample, operating the PT/INR products and reporting responsibilities.The position of trainer is per-diem and state/city specific.This job description will be reviewed periodically and is subject to change by management.RESPONSIBILITIES:The Trainer will:Remotely set up training appointment directly with the customer/caregiverTravel to the customers home setting within the general geographic location of the Trainer's homeDemonstrate and instruct the customer and/or their caregiver on the proper use and care of the PT/INR equipment.Explain test reporting optionsCommunicate and present themselves in a professional mannerAccurately document and submit patient training records electronicallyMaintain communications with Acelis Connected Health by cell phone, email and internet accessUtilize secure encrypted email to communicate anything that includes customers PHIHave reliable transportationBASIC QUALIFICATIONS | EDUCATION:The Trainer must have clinical experience.Current RegisteredNurse.Direct experience/exposure to anticoagulation management or homecare is preferredHealth education training experience a definite plusNo lifting over 15 pounds required without assistanceCOMPETENCIES/ EMPLOYMENT REQUIREMENTSCompletion of assigned educational prerequisites requiredProof of health screening documentationWeb based and interactive training provided by Acelis Connected HealthSuccessful completion of a consumer report (background check) and pre-employment drug screeningComputer and Smart Device proficiencyOwn a computer personal Laptop or Desktop computer to complete company requirements if neededHave access to a printerProficient in basic website and application troubleshooting using smart deviceTravel a minimum of 100 miles roundtrip requiredFlorida trainers only - there is an additional background step required for the state of Florida.Open Location:RN - Henderson, NVAn equal opportunity employer, Abbott welcomes and encourages diversity in our workforce.Connect with us at"" target=""_blank"" rel=""noopener noreferrer"">[www.linkedin.com/company/abbott-/](http://www.linkedin.com/company/abbott-/),on Facebook at[www.facebook.com/Abbott](http://www.facebook.com/Abbott)and on Twitter @AbbottNews and @AbbottGlobal.The base pay for this position is$22.15 - $44.35/hourIn specific locations, the pay range may vary from the range posted.JOB FAMILY:Customer ServiceDIVISION:HF Heart FailureLOCATION:United States of America : RemoteADDITIONAL LOCATIONS:WORK SHIFT:StandardTRAVEL:Yes, 100 % of the TimeMEDICAL SURVEILLANCE:Not ApplicableSIGNIFICANT WORK ACTIVITIES:Work with human blood or other potentially infectious materialsAbbott is an Equal Opportunity Employer ofMinorities/Women/IndividualswithDisabilities/ProtectedVeterans.EEO is the Law link - English:EEO is the Law link - Espanol:",https://abbott.wd5.myworkdayjobs.com/abbottcareers/job/United-States---Nevada---Henderson/Registered-Nurse---Patient-Educator--PRN--Immediate-Openings---Henderson--NV_31137134,"Biotech | Health Tech | Medical Device, Entry Level, Nurse Educator, Registered Nurse | RN",Remote Nurse Connection,2025-12-26T09:25:00.123117
PER DIEM - NURSE PRACTITIONER - 1099,Wisp,2025-12-16,Remote,Remote,Contract,,Must Be Licensed In: United States,$0 - $0,"Since 2018, Wisp has been on a mission to put healthcare back in patients' hands. We connect patients with hassle-free sexual + reproductive care online, with discreet and convenient treatment that saves them time, money, and stress. Our goal is to empower everyone to make the decisions about their health that are right for them. We've scaled quickly, serving patients across the nation and becoming part of the WELL Health family-and now we want you. We are a growing, fully-remote team in the United States looking for collaborators who are committed to our mission, passionate about results, eager to build something amazing, and excited to have high levels of ownership, accountability, and personal growth. Who We're Looking For We are currently looking for a Nurse Practitioner to join our Per Diem provider team (Hemlock LLC). You must be licensed to practice telemedicine in at least 15 synchronous telehealth states. Per Diem 1099 providers will be scheduled for activation during peak demand periods, including weekends, holidays, and the final week of each month. What You'll Do Conduct consultations via phone, video, or asynchronously based on state telemedicine regulations, only within full-practice states Provide exceptional patient care by using our custom EMR by evaluating patient records, diagnosing, and prescribing medication, and making lifestyle recommendations Follow best practices and company-specific policies to best diagnose and treat patients Foster an inclusive, non-judgemental environment for our patients by communicating compassionately with patients in our patient portal and answering patient questions related to care This Role Could Be A Good Fit For You If You have at least an additional 15 active independent state licenses in good standing including: AR, WV, DE, DC, KS, RI, VT You have completed an accredited FNP or WHNP program with a national certification You have ANCC board certification is required You have a minimum of 2 years e",https://app.nursefern.com,Telehealth,NurseFern,2025-12-26T09:26:58.968993
REGISTERED NURSE (RN) PATIENT NAVIGATOR,Ascension,2025-12-16,Remote,On-site,Full-time,Days,Must Be Licensed In: Tennessee,$0 - $0,"Details Department: Oncology Patient Navigator Schedule: Full-Time, Day Shift Hospital: Saint Thomas Midtown Location: Nashville, TN Benefits Paid time off (PTO) Various health insurance options & wellness plans Retirement benefits including employer match plans Long-term & short-term disability Employee assistance programs (EAP) Parental leave & adoption assistance Tuition reimbursement Ways to give back to your community Benefit options and eligibility vary by position. Compensation varies based on factors including, but not limited to, experience, skills, education, performance, location and salary range at the time of the offer. Responsibilities Serve as a patient navigator throughout the continuum of care. Function as a liaison for management staff, administration, physicians, managed care companies, community organizations, and other customers. Coordinate efforts for treatment and promote quality improvement and educational efforts. Compile data, track outcomes, and make recommendations for process improvement. Provide referrals/support for follow-up care for patients who are uninsured or underinsured. Requirements Licensure / Certification / Registration: Licensed Registered Nurse credentialed from the Tennessee Board of Nursing OR current home state license for multi-state license recognition ""Compact State"" obtained prior to hire date or job transfer date required. BLS Provider preferred. American Heart Association or American Red Cross accepted. Education: Diploma from an accredited school/college of nursing OR Required professional licensure at time of hire. Additional Preferences No additional preferences. Why Join Our Team Ascension Saint Thomas is a leading health care system with a 125-year history of providing care to the community, and is the only faith-based, non profit health system in Middle Tennessee. Today, the health system offers a highly comprehensive system of care, consisting of a network of hospitals, affiliated joint ve",https://app.nursefern.com,Case Management (CM),NurseFern,2025-12-26T09:27:01.062416
NURSE COHORT MANAGER L4 Q4 2025,PocketRN,2025-12-15,Remote,Remote,Full-time,,Must Be Licensed In: Compact,$0 - $0,,https://app.nursefern.com,,NurseFern,2025-12-26T09:27:03.153924
"TELEHEALTH TRIAGE, RN- 2ND SHIFT",Rightway,2025-12-15,Remote,Remote,Full-time,Evenings,Must Be Licensed In: Compact,$34 - $40.86,"SHIFT: Monday-Friday 2:30pm to 11:00pm EST. ABOUT THE ROLE: Under the general supervision of the Sr. Clinical Manager, the Telehealth Triage RN performs clinical triage, high-risk outreach, condition support, care planning, clinical education, and care coordination functions in supporting Rightway members with navigating, accessing, and best supporting their care needs. The Case Manager RN also serves as a trusted advisor for providing clinical guidance and directing to the most appropriate high-quality care providers with the objective of improving clinical outcomes while also reducing healthcare costs e.g. minimizing ED or other unnecessary care visits while increasing utilization of more appropriate care settings, such as primary care doctors. WHAT YOU'LL DO: Clinical triage to assess the severity of the member's health concerns using evidence-based protocols and algorithms in directing care to the right healthcare resource in a timely manner without compromising quality or safety Leveraging data-driven analytics in conducting proactive outreach to engage members of clinical interest, e.g. e high-risk, high-spend, rising risk, and evidence of care gaps with the objective of engaging and assisting members in making more informed care decisions, supporting across their continuum of care and well-being journey with lifestyle and behavior changes. Engage members in clinical conversations to best understand their care needs, assess risks, preferences, and care barriers, and then guide and recommend appropriate next steps to improve health outcomes Identify and address barriers preventing members from accessing preventative care or establishing ongoing relationships with primary care providers Assist in scheduling appointments, referrals, and follow-up care to close gaps in preventative care and chronic disease support Clinical navigation support includes but is not limited to personalized condition education, care options, and planning, care compliance, medicatio",https://app.nursefern.com,Triage,NurseFern,2025-12-26T09:27:05.238113
RN CASE MANAGER (DISCHARGE PLANNER) - RELOCATION OFFERED!,Medstar Health,2025-12-15,Remote,On-site,Full-time,Days,Must Be Licensed In: District of Columbia,"$89,065 - $162,801",About this Job: General Summary of Position Serves as a member of the Case Management Team and applies RN clinical expertise and medical appropriateness to care coordination and discharge planning. Facilitates the delivery of quality cost effective patient-centered care from pre-admission through post-discharge timeframe. Ensures the care is designed to meet individualized patient outcomes. Monitors the care and services delivered to selected patient populations during the acute hospital stay promotes effective case management and utilization of resources and works to achieve optimal clinical and resource outcomes for the acute and post-hospital phases of care. Primary Duties and Responsibilities Contributes to the achievement of established department goals and objectives and adheres to department policies procedures quality standards and safety standards. Complies with governmental and accreditation regulations. Collaborates with the multidisciplinary health care team to develop and coordinate the plan of care. Communicates with patient family and/or significant other health care team external case manager community resources and facility to address appropriate issues and patient/family goals. Demonstrates the ability to develop a plan of care that addresses needs across the continuum; have an intervention for problems identified; develop long- and short-term goals with specific time frames for resolution; identify specific services to be provided in the care plan; include the family/care-giver in the plan of care; and show life planning contingencies such as power of attorney and/or advance directives. Evaluates and documents the patient's response to the plan of care and achievement of outcomes. Makes recommendations for modifications to the plan of care as indicated. Adheres to all policies and procedures regarding documentation and confidentiality of information. Maintains knowledge of regulatory agencies' requirements necessary criteria for admission to,https://app.nursefern.com,Case Management (CM),NurseFern,2025-12-26T09:27:07.321928
