job_title,company,date_posted,location,remote_status,employment_type,schedule,license_requirements,salary_range,job_description,apply_link,specialties,source_site,scraped_at
RN REGISTERED NURSE - NURSING PROFESSIONAL DEVELOPMENT,Ascension,2025-11-26,Remote,On-site,Full-time,Days,Must Be Licensed In: Oklahoma,$0 - $0,"Details Department: Clinical Professional Development Schedule: FT, Monday-Friday, 8am-5pm Hospital: Ascension St. John Medical Center Location: Tulsa, OK Benefits Paid time off (PTO) Various health insurance options & wellness plans Retirement benefits including employer match plans Long-term & short-term disability Employee assistance programs (EAP) Parental leave & adoption assistance Tuition reimbursement Ways to give back to your community Benefit options and eligibility vary by position. Compensation varies based on factors including, but not limited to, experience, skills, education, performance, location and salary range at the time of the offer. Responsibilities Assess, plan, implement and evaluate educational activities related to nursing clinical areas across the continuum of care. Serve as a strategic consultant for nursing clinical performance initiatives to create, implement, and evaluate multi faceted competency-based programs, delivery mechanisms, and clinical performance. Collaborate with leaders and staff to assess nursing educational needs and competencies. Develop, implement, and evaluate nursing and clinical educational plans/programs. Utilize methods, measurements, and tools to evaluate achievement of learning goals. Consult on the analysis, design, development, implementation, and evaluation of Nursing Professional Development (NPD) programs and performance processes that support core nursing and clinical competency across the organization. Manage performance and competency standards for inter-professional programs to support practice at the highest extent of licensure. Requirements Licensure / Certification / Registration: BLS Provider obtained within 1 Month (30 days) of hire date or job transfer date required. American Heart Association or American Red Cross accepted. Registered Nurse credentialed from the Oklahoma Board of Nursing obtained prior to hire date or job transfer date required. Education: Diploma from an accredited",https://app.nursefern.com,Education,NurseFern,2025-12-26T09:28:24.664675
TELEPHONIC NURSE CASE MANAGER (REMOTE),Berkley Medical Management Solutions (BMMS),2025-11-25,Remote,Remote,Full-time,,"Must Be Licensed In: Compact, State Of Residency","$80,000 - $88,000","As a Telephonic Nurse Case Manager, you will assess, plan, coordinate, monitor, evaluate and implement options and services to facilitate timely medical care and return to work outcomes of injured workers. Coordinate and implement medical case management to facilitate case closure Timely and comprehensive communication with with employers, adjusters and the injured workers. Assess appropriate utilization of medical treatment and services available through contact with physicians and other specialist to ensure cost effective quality care Review and analyze medical records and assess data to ensure appropriate case management process occurs while providing recommendations to achieve case progress and movement to closure Responsible for assigned caseloads, which may vary in numbers, territory and/or by state jurisdiction Acquire and maintain nursing licensure for all jurisdictions as business needs require Coordinate services to include home services, durable medical equipment, IMEs, admissions, discharges, and vocational services when appropriate and evaluate cost effectiveness and quality of services Document activities and case progress using appropriate methods and tools following best practices for quality improvement Reviewing job analysis/job description with all providers to coordinate and implement disability case management. This includes coordinating job analysis with employer to facilitate return to work. Engage and participate in special projects as assigned by case management leadership team Occasionally attend on site meetings and professional programs Foster a teamwork environment Maintaining and updating evidence based medical guidelines (such as Official Disability Guidelines, MD Guidelines and all required state regulated guidelines) in reference to the injured worker treatment plan and work status. Obtain and maintain applicable state certifications and/or licensures in the state where job duties are performed. Obtain case management professional c",https://app.nursefern.com,Case Management (CM),NurseFern,2025-12-26T09:28:26.756443
"DIRECTOR, UTILIZATION MANAGEMENT",Antidote Health,2025-11-25,Remote,Hybrid,Full-time,Days,Must Be Licensed In: New York,$0 - $0,"Title: Director, Utilization Management Department: Clinical Operations Reports To: Vice President, Clinical Operations FLSA Status: Exempt Location: Hybrid, 2 days in office (Tuesday and Thursday in office 1460 Broadway New York, NY), 3 days Remote Position Summary The Manager, Utilization Management (UM) provides strategic and operational leadership for Antidote Health's UM programs. This role oversees authorization processes, medical necessity reviews, concurrent and retrospective review, and appeals/grievances. The Director ensures compliance with NCQA, CMS, and state regulations while balancing clinical appropriateness, operational efficiency, and member/provider satisfaction. The position is also responsible for vendor oversight of delegated UM entities, ensuring performance, compliance, and quality outcomes. Essential Duties and Responsibilities Leadership & Staff Development Supervise and evaluate UM supervisors and nursing staff. Provide coaching, feedback, and recognition to foster accountability, engagement, and retention. Ensure staff maintain current clinical competencies and meet NCQA/regulatory training requirements. Maintain staffing ratios that support timely review turnaround and regulatory compliance. Operations, Compliance & NCQA Direct day-to-day UM operations, including prior authorization, concurrent review, retrospective review, and appeals/grievances. Ensure all UM decisions follow evidence-based criteria (e.g., MCG) and regulatory requirements. Oversee documentation, workflows, and reporting to align with NCQA standards and state/federal regulations. Conduct audits, identify deficiencies, and implement corrective actions to maintain continuous readiness. Develop and update UM policies and procedures to ensure compliance and operational efficiency. Vendor Collaboration Act as primary liaison for delegated UM vendors. Monitor vendor performance and compliance with contractual and NCQA obligations. Escalate deficiencies, enforce corrective a",https://app.nursefern.com,Utilization Review & Management (UR/UM),NurseFern,2025-12-26T09:28:28.894140
NURSE PRACTITIONER - WOMEN'S & METABOLIC HEALTH,Maven,2025-11-25,Remote,Remote,Full-time,,Must Be Licensed In: Any State,$100 - $120,"Maven is seeking mission-driven, adaptable Nurse Practitioners to join our virtual care team supporting women and families across a broad spectrum of needs, from contraception and menopause management to metabolic and weight-related care. As Maven continues to expand its digital women's health platform, you will play a key role in delivering safe, evidence-based, and compassionate care that evolves with our members' needs. This includes prescribing and managing medications such as GLP-1 agonists, hormonal therapies, and contraceptives to support members through life-stage transitions. This is a 1099, remote, part-time or full-time contract position with flexible hours, ideal for clinicians who are passionate about combining clinical excellence with digital innovation, and comfortable working in a fast-changing environment. What You'll Do Conduct telehealth visits (video and asynchronous) to evaluate and manage members seeking care for metabolic health, weight management, hormonal transitions (e.g., perimenopause, menopause), or contraception. Prescribe and manage medications including GLP-1 receptor agonists, hormonal therapy, and contraceptives in accordance with evidence-based guidelines and Maven protocols. Collaborate with Maven's Medical Directors, RNs, and coaches to support member safety, adherence, and symptom management. Order and interpret labs and manage dose adjustments per protocol or clinical judgment. Provide education and counseling on lifestyle modification, behavioral strategies, and medication expectations to support long-term outcomes. Maintain accurate, timely documentation in Maven's EMR (MPractice) and adhere to QA and compliance workflows. Participate in case reviews, QA audits, and learning sessions, contributing feedback as Maven's care model evolves. Serve as a clinical ambassador for Maven's mission - helping members navigate health needs across reproductive, hormonal, and metabolic dimensions with empathy and expertise. Who You Are Li",https://app.nursefern.com,Telehealth,NurseFern,2025-12-26T09:28:30.999506
REMOTE FIELD RESOURCE NURSE (LPN/LVN),Float Health,2025-11-25,Remote,Remote,Full-time,"Days, Evenings, Weekends",Must Be Licensed In: State Of Residency,"$52,000 - $62,000","Float is hiring a fully remote LPN/LVN to support our SuperNurses in the field and serve as their first line of clinical guidance! About Float Float is the full-stack platform for Specialty Pharma home infusion. We're on a mission to make healthcare safer, easier, and more efficient by connecting SuperNurses to home medication visits - moving all care that doesn't need a hospital to the home. Float connects nurses with patients so they can get treatments for their chronic conditions in the home rather than going into the overcrowded hospital. Our model benefits all stakeholders - patients get more convenient care, nurses access flexible work for better pay, pharmacies fill more prescriptions, hospitals reduce low-reimbursement admissions, and payors enjoy 12x reduced costs with home-delivered care. Having closed our Series A in 2023, we're at an inflection point in our growth. We've successfully demonstrated multi-state expansion, validated strong unit economics, and boast remarkable retention of patients, nurses, and pharmacies. We've facilitated over 65,000 patient visits and are scaling our platform, team, and operations to serve more geographies and patients. The Role The Field Resource Nurse (LPN/LVN) is part of Float's centralized Clinical Resource team. This role provides real-time phone support to independent contractor nurses in the field, helping them troubleshoot workflows, documentation, and therapy-related questions during active visits. You'll be the first line of contact for Float's field nurses, ensuring they feel supported, informed, and confident while providing patient care. In this role, you'll also be reviewing clinical documentation and helping create plans of treatment. This is a great opportunity for a licensed practical or vocational nurse with experience in infusion or specialty pharmacy who communicates clearly, stays calm under pressure, and enjoys helping other clinicians succeed. This is a first-of-it's-kind role for Float Health",https://app.nursefern.com,,NurseFern,2025-12-26T09:28:33.097099
RN REGISTERED NURSE - CASE MANAGEMENT,Ascension,2025-11-25,Remote,On-site,Full-time,12hr shifts,Must Be Licensed In: Kansas,$0 - $0,"Details Department: Case Management Schedule: Full-time, day shift, 3 12 hour shifts per week, Friday-Sunday or Saturday-Monday Hospital: Ascension Via Christi St. Francis Location: 929 N. Saint Francis St, Wichita, KS 67214 Via Christi associates are eligible for tuition discounts and priority placement in select healthcare programs through our academic partnership with Wichita State University. Benefits Paid time off (PTO) Various health insurance options & wellness plans Retirement benefits including employer match plans Long-term & short-term disability Employee assistance programs (EAP) Parental leave & adoption assistance Tuition reimbursement Ways to give back to your community Benefit options and eligibility vary by position. Compensation varies based on factors including, but not limited to, experience, skills, education, performance, location and salary range at the time of the offer. Responsibilities Coordinate the overall interdisciplinary plan of care for patients from admission to discharge for the Case Management department. Create plan for care across the continuum. Integrate patient/family preferences and values. Advocate for resources and removal of barriers for the patient. Monitor patients' medical necessity and level of care through assessments, ongoing evaluations and/or patient records. Maintain ongoing dialog with supervisor and care transition team members to ensure effective implementation and reevaluation of care plan. Serve as a resource for adequate medical record documentation, level of care recommendations, and services as they relate to diagnoses and treatment options for post-discharge care. Act as a liaison between patient and post acute services. Collaborate with payers for benefit optimization. Advocate for effective and efficient utilization of clinical resources. Requirements Licensure / Certification / Registration: Licensed Registered Nurse credentialed from the Kansas Board of Nursing obtained prior to hire date",https://app.nursefern.com,Case Management (CM),NurseFern,2025-12-26T09:28:35.193665
UTILIZATION MANAGEMENT NURSE,Humana,2025-11-24,Remote,Remote,Full-time,Days,"Must Be Licensed In: Compact, State Of Residency","$71,100 - $97,800","Conviva Care Solutions is seeking a RN who will collaborate with other health care givers in reviewing actual and proposed medical care and services against established CMS Coverage Guidelines/NCQA review criteria and who is interested in being part of a team that focuses on excellent service to others. Use your skills to make an impact Required Qualifications Active unrestricted RN license with the ability to obtain Compact Nursing License A minimum of three years clinical RN experience; Prior clinical experience, managed care experience, OR utilization management experience Demonstrates Emotional Maturity Ability to work independently and within a team setting Willing to work in multiple time zones Strong written and verbal communication skills Attention to detail, strong computer skills including Microsoft office products Ability to work in fast paced environment Ability to form positive working relationships with all internal and external customers Preferred Qualifications Education: BSN or bachelor's degree in a related field Experience with Physical Therapy, DME, Cardiac or Orthopedic procedures Previous experience in utilization management within Insurance industry Previous Medicare Advantage/Medicare Current nursing experience in Hospital, SNF, LTAC, DME or Home Health. Bilingual Alert Humana values personal identity protection. Please be aware that applicants may be asked to provide their Social Security Number, if it is not already on file. When required, an email will be sent from Humana@myworkday.com with instructions on how to add the information into your official application on Humana's secure website. Interview Format - HireVue As part of our hiring process for this opportunity, we will be using an interviewing technology called HireVue to enhance our hiring and decision-making ability. HireVue allows us to quickly connect and gain valuable information from you pertaining to your relevant skills and experience at a ti",https://app.nursefern.com,Utilization Review & Management (UR/UM),NurseFern,2025-12-26T09:28:37.301438
INTEGRATED CARE MANAGER (FEP) (REMOTE-AZ),Blue Cross Blue Shield of Arizona,2025-11-24,Remote,Remote,Full-time,Days,Must Be Licensed In: Arizona,$0 - $0,"This position is Remote within the state of AZ only. This remote work opportunity requires residency, and work to be performed, within the State of Arizona. Purpose of the job Responsible for promoting continuity of care through a collaborative process that assesses, plans, implements, coordinates, monitors, and evaluates care options and services available to members through their benefit plan that meet the individuals' health care needs while promoting quality, cost effective outcomes. This job description is primary for case management functions but can assist with utilization management if a business need arises. Qualifications REQUIRED QUALIFICATIONS Required Work Experience 2 year(s) of experience in full-time equivalent of direct clinical care to the consumer Required Education Associate's Degree in general field of study or Post High School Nursing Diploma or Master's Degree in a behavioral health field of study (i.e., MSW, MA, MS, M.Ed.), Ph.D. or Psy.D Required Licenses Active, current, and unrestricted license to practice in the State of Arizona (or an endorsement to work in Arizona) as a behavioral health professional such as LCSW, LPC, LISAC LMFT, or licensed psychologist (Psy.D. or Ph.D.), OR an active, current, and unrestricted license to practice nursing in either the State of Arizona or another state in the United States recognized by the Nursing Licensure Compact (NLC) as an RN. Required Certifications Within 4 years of hire as a Care Manager employee must hold a certification in case management from the following certifications; Certified Case Manager (CCM), Certified Disability Management Specialist (CDMS), Case Management Administrator, Certified (CMAC), Case Management Certified (CMC), Certified Rehabilitation Counselor (CRC), Certified Registered Rehabilitation Counselor (CRRC), Certified Occupational Health Nurse (COHN), Registered Nurse Case Manager (RN, C), or Registered Nurse Case Manager (RN,BC). PREFERRED QUALIFICATIONS Prefer",https://app.nursefern.com,Case Management (CM),NurseFern,2025-12-26T09:28:39.389153
PEDIATRIC BEHAVIORAL HEALTH NURSE CARE MANAGER,Included Health,2025-11-24,Remote,Remote,Full-time,Days,"Must Be Licensed In: California, Compact","$73,700 - $103,180","We're looking for a Pediatric Behavioral Health Nurse Care Manager to join our Care and Case Management team-someone passionate about supporting children, adolescents, and their families holistically through their healthcare journey with deep focus around behavioral health. This role is ideal for a nurse who brings both clinical expertise and deep compassion to their work, ensuring the unique behavioral health needs of pediatric members are met with innovative, evidence-based interventions. The telephonic Nurse Care Manager will support members navigating complex behavioral and medical health challenges. You'll collaborate with a multidisciplinary team of healthcare professionals, care coordinators, and records specialists to deliver integrated, remote care in a virtual-first environment. The ideal candidate enjoys spending time on the phone with families, listening deeply, answering questions, and advocating for their needs. You should excel in creating and managing care plans, navigating behavioral health resources, and offering clinical guidance that supports both short- and long-term outcomes. Schedule: Monday-Friday 9am-6pm PST Responsibilities: Deliver coordinated, family-centered virtual Care Management by phone that improves behavioral health outcomes for pediatric members. Develop personalized, goal-oriented care plans in collaboration with families and our multidisciplinary team. Support members through behavioral health treatment plans, transitions of care, and episodes of acute behavioral health crises. Help families navigate behavioral health systems, treatment options, benefits, and community-based resources. Partner with local pediatricians, behavioral health specialists, schools, and other care team members to ensure aligned, coordinated care. Provide compassionate, longitudinal support to families through continuous engagement and advocacy. Coordinate resources that address clinical, behavioral, and social determinants of health impacting the chil",https://app.nursefern.com,Case Management (CM),NurseFern,2025-12-26T09:28:41.478101
LPN BACK OFFICE COORDINATOR - ATHENS ORTHO,Piedmont,2025-11-24,Remote,On-site,Full-time,Days,Must Be Licensed In: Georgia,$0 - $0,"Overview: Responsible for functioning as a hands-on working supervisor and under general direction: plans, assigns, and oversees the daily activities of specified clinical employees that perform a variety of patient care activities in accordance with established standards and protocols. Responsible for maintaining sufficient clinical staffing levels and adequate medical supplies needed to run the day-to-day operation of the practice. Responsibilities: Responsible for functioning as a hands-on working supervisor and under general direction: plans, assigns, and oversees the daily activities of specified clinical employees that perform a variety of patient care activities in accordance with established standards and protocols. Responsible for maintaining sufficient clinical staffing levels and adequate medical supplies needed to run the day-to-day operation of the practice. Qualifications: Education Successful completion of an accredited practical nurse program Required Work Experience 3 years of back office experience in a healthcare setting Required Licenses and Certifications LPN - Licensed Practical Nurse - State Licensure State of Georgia licensure as a practical nurse Upon Hire Required and BCLS - Basic Life Support Upon Hire Required Business Unit : Name: Athens Reg Specialty Services",https://app.nursefern.com,,NurseFern,2025-12-26T09:28:43.575351
TELEPHONIC CASE MANAGER,Enlyte,2025-11-23,Remote,Remote,Full-time,Days,"Must Be Licensed In: California, Compact","$80,000 - $86,000","At Enlyte, we combine innovative technology, clinical expertise, and human compassion to help people recover after workplace injuries or auto accidents. We support their journey back to health and wellness through our industry-leading solutions and services. Whether you're supporting a Fortune 500 client or a local business, developing cutting-edge technology, or providing clinical services you'll work alongside dedicated professionals who share your commitment to excellence and make a meaningful impact. Join us in fueling our mission to protect dreams and restore lives, while building your career in an environment that values collaboration, innovation, and personal growth. Be part of a team that makes a real difference. Job Description This is a full-time, flexible work from home position and can be located anywhere in the U.S. RN Compact with CA license required Workers compensation experience preferred Perks: Full and comprehensive benefits program, 24 days of paid vacation/holidays in your first year plus sick days, home office equipment including laptop and desktop monitor, Employee Assistance and Referral Program, and hands-on workers' compensation case management training. Join our compassionate team and help make a positive difference in an injured person's life. As a Telephonic Case Manager, you will work closely with treating physicians/providers, employers, customers, legal representatives, and the injured/disabled person to create and implement a treatment plan that returns the injured/disabled person back to work appropriately, ensure appropriate and cost-effective healthcare services, achievement of maximum medical recovery and return to an optimal level of work and functioning. In this role, you will: Demonstrate knowledge, skills, and competency in the application of case management standards of practice. Use advanced knowledge of types of injury, medications, comorbidities, treatment options, treatment alternatives, and knowledg",https://app.nursefern.com,Case Management (CM),NurseFern,2025-12-26T09:28:45.679377
"RN - CARE MANAGER, PRN",Piedmont,2025-11-23,Remote,On-site,PRN/Per Diem,,Must Be Licensed In: Georgia,$0 - $0,"Overview: This is a PRN position with the needs to be available on weekends and weekdays during the day. Responsibilities: The Care Manager is responsible for care coordination, progression of care, and proactive discharge planning and is accountable for expediting the timely and safe discharge for all patients in their case load. Qualifications: Education Graduate of Nursing Program Required Master's degree Master's degree Preferred Work Experience 2 years of experience in an acute or post-acute setting Required Experience using InterQual or Milliman Preferred Licenses and Certifications Current unrestricted registered nurse (RN) license, or eligible for licensure, in the state of Georgia Required Additional Licenses and Certifications Certification in Case or Care Management Preferred Business Unit : Name: Piedmont Newton Hospital",https://app.nursefern.com,Case Management (CM),NurseFern,2025-12-26T09:28:47.772628
