job_title,company,date_posted,location,remote_status,employment_type,schedule,license_requirements,salary_range,job_description,apply_link,specialties,source_site,scraped_at
RN - CASE MANAGER - FULL TIME - DAYS - 4 - 9.5 HOUR SHIFTS,Mohawk Valley Health System,2025-12-09,Remote,On-site,Full-time,9hr shifts,Must Be Licensed In: New York,$38.74 - $54.47,"Job Summary Reports to and is under direct supervision of Case Management Department. Provides ongoing support and expertise through comprehensive assessment, planning, implementation and overall evaluation of individual patient needs. Promotes continuity of care and cost effectiveness through the integrating and functions of case management. Core Job Responsibilities Coordinates discharge planning to assure that the patient progresses through the continuum of care and is discharged to the least restrictive environment. Coordinate the hospital activities concerned with case management and discharge planning. Ensure compliance with quality patient care and regulatory compliance. Education/Experience Requirements Required: Minimum of two (2) years utilization review/case management experience or social work experience. Preferred: Associate degree in healthcare related filed. Bachelor's degree is preferred. Licensed professional nurse may be considered. Bachelors or Masters Degree in related healthcare field (such as respiratory therapy or social work) may be considered. Licensure/Certification Requirements Required: Maintain current professional licensure in nursing or professional filed of certification. Preferred: Appropriate certification in the case management preferred (e.g. Commission for Case Management Certification (CCMC) or Association of Rehabilitation Nurses). Disclaimer Qualified applicants will receive consideration for employment without regard to their age, race, religion, national origin, ethnicity, age, gender (including pregnancy, childbirth, et al), sexual orientation, gender identity or expression, protected veteran status, or disability. Successful candidates might be required to undergo a background verification with an external vendor. Job Details Req Id 95653 Department CASE MGMT Shift Days Shift Hours Worked 9.50 FTE 0.94 Work Schedule NYSNA - 9.5 x 4 Employee Status A1 - Full-Time Union 2004 - NYSNA Pay Range $38.74 - $54.47/H",https://app.nursefern.com,Case Management (CM),NurseFern,2025-12-26T09:27:34.524672
ASSOCIATE AUDITOR CLINICAL VALIDATION DRG,Cotiviti,2025-12-08,Remote,Remote,Full-time,Days,"Must Be Licensed In: Any State, State Of Residency",$31.25 - $38.46,"This auditing role will focus on Coding & Clinical Chart Validation for our Inpatient audits. The ideal candidate for this position needs to have both a clinical (nurse) and a coding / auditing background focused on the following disciplines from a coding and billing perspective: Inpatient DRG/APR-DRG and/or episode of care. This position is responsible for auditing inpatient claims and documenting the results of those audits, with a focus on clinical review, coding accuracy, and the appropriateness of treatment setting and services delivered. This position will start on February 2, 2026 and will be in scheduled group training for the first 6 weeks (no time off during this time). Responsibilities Analyzes and Audits Claims. Integrates medical chart coding principles, clinical guidelines and objectivity in performance of medical audit activities. Draws on advanced ICD-10 coding expertise, clinical guidelines, and industry knowledge to substantiate conclusions. This review may include medical record review and/or episode of care reviews. Performs work independently. Effectively Utilizes Audit Tools. Utilizes Cotiviti proprietary auditing systems with a high level of proficiency to make audit determinations and generate audit letters. Meets or Exceeds Standards/Guidelines for Productivity. Maintains production goals set by the audit operations management team. Meets or Exceed Standards/Guidelines for Accuracy and Quality. Achieves the expected level of accuracy and quality set by the audit for the auditing concept, for valid claim identification and documentation (letter writing). Identifies New Claim Types. Identifies potential claims outside of the concept where additional recoveries may be available. Suggests and develops high quality, high value concept and or process improvement, tools, etc. Complete all responsibilities as outlined in the annual performance review and/or goal setting. Complete all special projects and other duties as assigned. Must be able",https://app.nursefern.com,"Clinical Documentation Integrity (CDI), Quality",NurseFern,2025-12-26T09:27:36.606643
RN PRIOR AUTHORIZATION NURSE - MEDICAID (REMOTE AZ),Blue Cross Blue Shield of Arizona,2025-12-08,Remote,Remote,Full-time,Days,Must Be Licensed In: Arizona,$0 - $0,"This remote work opportunity requires residency, and work to be performed, within the State of Arizona. PURPOSE OF THE JOB Under the direction of the Prior Authorization Management (PA), ensures prospective review/prior authorization requests are completed in a timely fashion to meet contractual requirements and ensures all reviews are conducted using nationally recognized and evidence-based standards. QUALIFICATIONS REQUIRED QUALIFICATIONS Required Work Experience 2 years of clinical experience 1 year of Medicaid/Medicare experience 1 year of experience managing multiple projects Required Education Associate degree in Nursing Required Licenses Active, current, and unrestricted license to practice in the State of Arizona (a state in the United States) as a health professional, including RN or LPN. Required Certifications N/A PREFERRED QUALIFICATIONS Preferred Work Experience 1 year of experience in managed care 1 year of experience in prior authorization/utilization review Preferred Education Bachelor's Degree in Nursing Preferred Licenses N/A Preferred Certifications N/A ESSENTIAL JOB FUNCTIONS AND RESPONSIBILITIES ALL LEVELS Ensures prior authorization requests are completed accurately, thoroughly, and in a timely fashion to meet contractual requirements. Coordinates and follows the established preauthorization review process for pre-service requests. Ensures all reviews are conducted using nationally recognized and evidence-based standards. Utilize clinical skills, chart review, physician communication and appropriate criteria for approval of pre-service requests; escalate pre-service request to the Medical Director for determination when criteria is not met. Clearly define and document review rationale to support approval, Medical Director Review and/or Notice of Action document. Initiates interdepartmental coordination to ensure quality and timely care for members. Participates in Quality Improvement Projects as directed. Assists the management t",https://app.nursefern.com,"Utilization Review & Management (UR/UM), Prior Authorization (PA)",NurseFern,2025-12-26T09:27:38.693882
"BUSINESS ANALYST, APPEALS & GRIEVANCES",Clover Health,2025-12-08,Remote,Remote,Full-time,Days,Must Be Licensed In:,$0 - $0,"Clover is reinventing health insurance by working to keep people healthier. At Clover Health, we bring high-quality, affordable, and easy-to-understand healthcare plans to America's seniors. We focus on preventive care and leverage data and technology from the Clover Assistant to empower physicians to make the best health recommendations based on our members' complete health history-all with the lowest cost and the highest value. As a Business Analyst for Grievances, Appeals & Disputes (A&G), you'll serve as a key partner in ensuring our operations are compliant, efficient, and transparent. You'll transform data into actionable insights, strengthen operational performance, and directly impact member experience and quality outcomes across our Medicare Advantage business. We're prioritizing candidates in the Central or Eastern time zones for real-time collaboration. As a Business Analyst, you will: Deliver timely daily and weekly operational reports to track case volumes, timeliness, and performance against KPIs. Validate A&G case inventory for accuracy, completeness, and compliance with CMS requirements. Analyze operational data to identify trends, root causes, and opportunities for process improvement. Collaborate with Operations, Compliance, and IT to implement workflow enhancements and regulatory updates. Support the development and integration of CMS and organizational guidance into operational systems. Partner with the Quality and STARS teams to monitor decision-making metrics and drive performance improvements. Prepare for audits by ensuring reporting and documentation are accurate, comprehensive, and audit-ready. Provide data-driven insights to cross-functional partners and governance committees to enhance member experience. Success in this role looks like: In the first 90 days: You've developed a strong understanding of Clover's A&G operations, are producing accurate daily reports, and maintaining reliable inventory validation processes. In the first 6",https://app.nursefern.com,Quality,NurseFern,2025-12-26T09:27:40.785103
REGISTERED NURSE RN QUALITY MANAGEMENT,HCA,2025-12-08,Remote,On-site,Full-time,Days,Must Be Licensed In: Texas,$0 - $0,"Description Introduction Do you currently have an opportunity to make a real impact with your work? With over 2,000 sites of care and serving over 31.2 million patient interactions every year, nurses at HCA Houston Healthcare Clear Lake have the opportunity to make a real impact. As a(an) Registered Nurse RN Quality Management you can be a part of change. Benefits HCA Houston Healthcare Clear Lake, offers a total rewards package that supports the health, life, career and retirement of our colleagues. The available plans and programs include: Comprehensive medical coverage that covers many common services at no cost or for a low copay. Plans include prescription drug and behavioral health coverage as well as free telemedicine services and free AirMed medical transportation. Additional options for dental and vision benefits, life and disability coverage, flexible spending accounts, supplemental health protection plans (accident, critical illness, hospital indemnity), auto and home insurance, identity theft protection, legal counseling, long-term care coverage, moving assistance, pet insurance and more. Free counseling services and resources for emotional, physical and financial wellbeing 401(k) Plan with a 100% match on 3% to 9% of pay (based on years of service) Employee Stock Purchase Plan with 10% off HCA Healthcare stock Family support through fertility and family building benefits with Progyny and adoption assistance. Referral services for child, elder and pet care, home and auto repair, event planning and more Consumer discounts through Abenity and Consumer Discounts Retirement readiness, rollover assistance services and preferred banking partnerships Education assistance (tuition, student loan, certification support, dependent scholarships) Colleague recognition program Time Away From Work Program (paid time off, paid family leave, long- and short-term disability coverage and leaves of absence) Employee Health Assistance Fund that offers free emp",https://app.nursefern.com,Quality,NurseFern,2025-12-26T09:27:42.876669
PATIENT SUPPORT NURSE,Mercalis,2025-12-05,Remote,Remote,Full-time,,Must Be Licensed In: Any State,$0 - $0,"Valeris is a fully integrated life sciences commercialization partner that provides comprehensive solutions that span the entire healthcare value chain. Formed by the merger of PharmaCord and Mercalis, Valeris revolutionizes the path from life sciences innovation to real-life impact to build a world in which every patient gets the care they need. Valeris works on behalf of life sciences companies to improve the patient experience so that patients can access and adhere to critical medications. Backed by proven industry expertise, a deep commitment to patient care, the latest technology, and exceptionally talented team members, Valeris provides the data and strategic insights, patient support services and healthcare provider engagement tools to help life sciences companies successfully commercialize new products. Valeris provides commercialization solutions to more than 500 life sciences customers and has provided access and affordability support to millions of patients. The company is headquartered in Morrisville, North Carolina and Jeffersonville, Indiana. To learn more about Valeris, please visit www.valeris.com. The Patient Support Nurse will provide support for Oncology patients and caregivers over the phone, by being able to speak to the end-to-end journey for patients in the context of the Oncology program specifics. Responsibilities Serve as the initial point of contact for callers, including patients, their care partners, and/or their HCP/office staff to provide approved information and education for Oncology specific care including benefit discussions, disease progression and product education, along with general and program specific resources. This role is NOT to provide medical advice. Provide program specific treatment education via approved FAQs/Talking Points. When appropriate, facilitate a warm transfer to key program stakeholders (i.e. Specialty Pharmacy or Medical Information) to support inquiries outside of the role's remit. Utilize Valeris",https://app.nursefern.com,Triage,NurseFern,2025-12-26T09:27:44.970817
RN COORDINATOR TRAUMA PROCESS IMPROVEMENT,HCA,2025-12-05,Remote,On-site,Full-time,Days,Must Be Licensed In: Missouri,$0 - $0,"Description Introduction Do you currently have an opportunity to make a real impact with your work? With over 2,000 sites of care and serving over 31.2 million patient interactions every year, nurses at Research Medical Center have the opportunity to make a real impact. As a(an) RN Coordinator Trauma Process Improvement you can be a part of change. Benefits Research Medical Center, offers a total rewards package that supports the health, life, career and retirement of our colleagues. The available plans and programs include: Comprehensive medical coverage that covers many common services at no cost or for a low copay. Plans include prescription drug and behavioral health coverage as well as free telemedicine services and free AirMed medical transportation. Additional options for dental and vision benefits, life and disability coverage, flexible spending accounts, supplemental health protection plans (accident, critical illness, hospital indemnity), auto and home insurance, identity theft protection, legal counseling, long-term care coverage, moving assistance, pet insurance and more. Free counseling services and resources for emotional, physical and financial wellbeing 401(k) Plan with a 100% match on 3% to 9% of pay (based on years of service) Employee Stock Purchase Plan with 10% off HCA Healthcare stock Family support through fertility and family building benefits with Progyny and adoption assistance. Referral services for child, elder and pet care, home and auto repair, event planning and more Consumer discounts through Abenity and Consumer Discounts Retirement readiness, rollover assistance services and preferred banking partnerships Education assistance (tuition, student loan, certification support, dependent scholarships) Colleague recognition program Time Away From Work Program (paid time off, paid family leave, long- and short-term disability coverage and leaves of absence) Employee Health Assistance Fund that offers free employee-only covera",https://app.nursefern.com,Quality,NurseFern,2025-12-26T09:27:47.062178
RN COORDINATOR TRAUMA WOMENS WEEKENDS,HCA,2025-12-05,Remote,On-site,Part-time,Nights,Must Be Licensed In: Missouri,$0 - $0,"Description Introduction Research Medical Center is committed to investing in the latest technology enabling nurses to work more efficiently.Are you passionate about delivering patient-centered care?Submit your application for our RN Coordinator position and spend more time at the bedside with the patient. Benefits Research Medical Center, offers a total rewards package that supports the health, life, career and retirement of our colleagues. The available plans and programs include: Comprehensive medical coverage that covers many common services at no cost or for a low copay. Plans include prescription drug and behavioral health coverage as well as free telemedicine services and free AirMed medical transportation. Additional options for dental and vision benefits, life and disability coverage, flexible spending accounts, supplemental health protection plans (accident, critical illness, hospital indemnity), auto and home insurance, identity theft protection, legal counseling, long-term care coverage, moving assistance, pet insurance and more. Free counseling services and resources for emotional, physical and financial wellbeing 401(k) Plan with a 100% match on 3% to 9% of pay (based on years of service) Employee Stock Purchase Plan with 10% off HCA Healthcare stock Family support through fertility and family building benefits with Progyny and adoption assistance. Referral services for child, elder and pet care, home and auto repair, event planning and more Consumer discounts through Abenity and Consumer Discounts Retirement readiness, rollover assistance services and preferred banking partnerships Education assistance (tuition, student loan, certification support, dependent scholarships) Colleague recognition program Time Away From Work Program (paid time off, paid family leave, long- and short-term disability coverage and leaves of absence) Employee Health Assistance Fund that offers free employee-only coverage to full-time and part-time colleagues ba",https://app.nursefern.com,Quality,NurseFern,2025-12-26T09:27:49.149846
"CODING QUALITY AUDITOR, HEDIS *REMOTE - MANY STATES ELIGIBLE*",Providence,2025-12-04,Remote,Remote,Full-time,Days,Must Be Licensed In: State Of Residency,$0 - $0,"ReqID: 403837 Job Category: Coding Shift: Multiple shifts available Schedule: Part time Work Location: Murray Business Ctr Beaverton-Beaverton Providence Health Plan caregivers are not simply valued - they're invaluable. Join our team and thrive in our culture of patient-focused, whole-person care built on understanding, commitment, and mutual respect. Your voice matters here, because we know that to inspire and retain the best people, we must empower them. Providence Health Plan is calling a Coding Quality Auditor, HEDIS who will: Be responsible for conducting clinical quality audits/overreads for the Quality Department Identify and reports issues related to clinical audits to determine potential areas for quality improvement within the HEDIS project Collect data by way of chart extraction, using objective specifications for the Healthcare Effectiveness and Data Information Set (HEDIS) program Conduct Audits inclusive of review of outpatient medical records, hospital records, clinical lab and pharmacy records Be responsible for collecting data based on standardized methodologies Organize the data to identify and address opportunities for improvement Perform chart audits electronically during the audit season Complete HEDIS training prior to performing chart abstractions Be provided direction regarding charts requiring auditing Maintain all collected records in a confidential manner Performs all duties in a manner which promotes team concept and reflects the Sisters of Providence mission and philosophy Communicate in a collaborative manner with clinic and other staff with whom they interact, in a manner that represents Sisters of Providence Please note the following important detail regarding this HEDIS Seasonal Role: This posting is for multiple openings of a Coding Quality Auditor, HEDIS This position is affiliated with Providence Health Plan and will be tied to a location and compensation range in Beaverton, Oregon Position Type: Temporary,",https://app.nursefern.com,HEDIS,NurseFern,2025-12-26T09:27:51.246127
LICENSED NURSE PRACTITIONER,Mochi Health,2025-12-04,Remote,Remote,Contract,,"Must Be Licensed In: Any State, State Of Residency",$0 - $0,"Mochi Health's mission is to be the discovery layer of healthcare. We are building a platform that makes it easier for patients to find the right providers, access the right medications, and take control of their health with transparency and trust. Over the past few years, we have experienced rapid growth by combining operational excellence, clinical expertise, and innovative technology to deliver care that is more human, intuitive, and effective. From pharmacy pricing transparency and personalized medication management, to long-term medical record access and community-based chronic illness support, Mochi is creating a new model of care that empowers patients, providers, and pharmacies alike. We believe the future of healthcare is personal, and we are building the technology to power it. At Mochi Health, you will join a team that values inclusivity, collaboration, and bold thinking, and you will have the opportunity to do the most meaningful work of your career. About The Role Mochi Health, originally founded as an obesity management practice, is expanding its virtual care model beyond weight management. We're looking for licensed nurse practitioners who are committed to delivering high-quality, accessible, and affordable care across a growing range of specialties. While obesity and metabolic health remain core areas of focus, our providers also support patients in areas such as dermatology, hormone replacement therapy, depression & anxiety, and hair loss. What You'll Do Conduct virtual visits for adults with acute, chronic, and complex medical conditions. Provide ongoing obesity and metabolic health management, including GLP-1s and related treatments. Deliver patient care in expanding domains such as dermatology, hormone replacement therapy, depression and anxiety, and hair loss management. Work closely with Mochi's multidisciplinary care team to coordinate patient care. Use cost-conscious prescribing practices, offering compounded and generic options when appr",https://app.nursefern.com,Telehealth,NurseFern,2025-12-26T09:27:53.334639
NURSE CARE MANAGER,Honest Health,2025-12-04,Remote,Remote,Full-time,Days,"Must Be Licensed In: New York, Michigan","$76,600 - $88,000","You will manage patients' specialized needs based on their individual condition(s) and/or reason for recent utilization in collaboration with physicians, advanced practice providers, and care coordination team members. Your job duties will include taking full ownership of assigned patients with complex chronic conditions, serious illness, advanced frailty, or recent healthcare utilization with the goal of avoiding preventable admissions, reducing unnecessary healthcare use, and optimizing patient outcomes. Through standardized assessments and workflows you will work with the patient to identify needs based on their values, goals and preferences. From this assessment, in partnership with the patient, you will develop an effective, and comprehensive plan of care for each member. Care plans will be used to coordinate patient care delivery with Honest clinicians, network providers, contracted vendors, and community-based services. This work takes place remotely, but you must be licensed in the state(s) where the role is based: Michigan and/or New York Primary Functions Include: Quickly build empathetic relationships with patients and families. Evaluate and identify patients' needs based on their respective values, goals, and preferences, then translate these needs into clinical needs. Interface with primary care physicians, advanced practice providers (APP), specialists, and various disciplines on the development of case management plans/programs. In conjunction with the physician/APP, implement care/treatment plans by coordinating access to health services across multiple providers/ disciplines. Refer patients to internal Honest team members for care management activities as outlined by defined procedures. Monitor care and identify cost-effective measures, including recommendations for alternative levels of care and utilization of resources. In partnership with Honest team members, effectively coordinate patient admissions and discharges from hospitals or skilled",https://app.nursefern.com,Case Management (CM),NurseFern,2025-12-26T09:27:55.425731
